<?xml version="1.0" encoding="Shift_JIS" ?>

<!ELEMENT cars     (car+)>
<!ELEMENT car      (name, price)>
<!ELEMENT name     (#PCDATA)>
<!ELEMENT price    (#PCDATA)>

